{
  "id": "curl-biceps-tumbado-polea",
  "name": "Curl de bíceps tumbado en polea",
  "image_male": "images/curl-biceps-tumbado-polea-male.webp",
  "image_female": "images/curl-biceps-tumbado-polea-female.webp",
  "muscle_group": "bíceps",
  "secondary_muscles": ["antebrazos"],
  "equipment": "polea",
  "difficulty": "intermediate",
  "instructions": "Túmbate boca arriba en un banco con la cabeza alejada de una polea baja y sujeta una barra recta en supinación. Mantén los brazos superiores junto al torso y los codos quietos. Flexiona los codos para acercar la barra a los hombros, contrae los bíceps y vuelve hasta casi extenderlos por completo."
}
